{
  "id": "team.grid-4",
  "sectionType": "team",
  "layout": "grid-4",
  "style": ["modern-minimal", "corporate", "playful-rounded", "dark-tech", "editorial-serif"],
  "industry": ["*"],
  "tone": [],
  "entry": "TeamGrid4.tsx",
  "requires": ["framer-motion", "lucide-react"],
  "dependsOnComponents": [],
  "complexity": "section",
  "supportsAnimation": true,
  "animationLevel": ["none", "subtle", "moderate", "expressive"],
  "props": {
    "heading": { "type": "string" },
    "subheading": { "type": "string" },
    "members": { "type": "array" }
  },
  "previewDescription": "4-column team grid with avatar, name, role, optional bio and social links per member."
}
