{"id":"pricing-calculator.interactive","sectionType":"pricing-calculator","layout":"interactive","style":["modern-minimal","corporate","dark-tech"],"industry":["saas-landing","ecommerce","travel","agency"],"tone":["professional","technical"],"entry":"PricingCalculatorInteractive.tsx","requires":[],"props":{"heading":{"type":"string"},"basePrice":{"type":"number"},"href":{"type":"string"}},"complexity":"section","previewDescription":"Interactive quantity and estimate calculator with conversion CTA."}