{"id":"number-counter.animated","sectionType":"number-counter","layout":"animated","style":["modern-minimal","corporate","dark-tech"],"industry":["*"],"tone":["professional","bold"],"entry":"NumberCounterAnimated.tsx","requires":["framer-motion"],"props":{"items":{"type":"array"}},"supportsAnimation":true,"animationLevel":["subtle","moderate"],"complexity":"section","previewDescription":"Animated numerical metrics that count into view as users scroll."}