{"id":"hero.immersive","sectionType":"hero","layout":"immersive","style":["modern-minimal","editorial-serif","gradient-vibrant","dark-tech"],"industry":["*"],"tone":["professional","premium","editorial","bold"],"entry":"HeroImmersive.tsx","requires":[],"props":{"heading":{"type":"string"},"subheading":{"type":"string"},"items":{"type":"array"}},"supportsAnimation":true,"animationLevel":["subtle","moderate"],"complexity":"section","previewDescription":"Immersive hero with badge, dual CTA and metric cards."}