{
  "id": "team.compact-grid",
  "sectionType": "team",
  "layout": "compact-grid",
  "style": ["modern-minimal", "corporate", "playful-rounded", "monochrome"],
  "industry": ["*"],
  "tone": [],
  "entry": "TeamCompactGrid.tsx",
  "requires": ["framer-motion"],
  "dependsOnComponents": [],
  "complexity": "section",
  "supportsAnimation": true,
  "animationLevel": ["none", "subtle", "moderate"],
  "props": {
    "heading": { "type": "string" },
    "subheading": { "type": "string" },
    "members": { "type": "array" }
  },
  "previewDescription": "Small avatar, name, and role only in a dense up-to-6-column grid, no bio or socials — built for larger teams (8+ people) where the grid-4/side-list layouts would get too tall."
}
