{"id":"feature-carousel.cards","sectionType":"feature-carousel","layout":"cards","style":["modern-minimal","editorial-serif","playful-rounded"],"industry":["*"],"tone":["premium","friendly","bold"],"entry":"FeatureCarouselCards.tsx","requires":[],"props":{"heading":{"type":"string"},"items":{"type":"array"}},"complexity":"section","previewDescription":"Horizontal snap carousel for featured destinations, products or stories."}