{"id":"cta.floating-card","sectionType":"cta","layout":"floating-card","style":["modern-minimal","editorial-serif","gradient-vibrant"],"industry":["*"],"tone":["premium","bold","professional"],"entry":"CtaFloatingCard.tsx","requires":[],"props":{"heading":{"type":"string"},"items":{"type":"array"}},"supportsAnimation":true,"animationLevel":["subtle","moderate"],"complexity":"section","previewDescription":"Elevated conversion card with benefits and dual CTAs."}