{"id":"feature-comparison.sticky","sectionType":"feature-comparison","layout":"sticky","style":["modern-minimal","corporate","editorial-serif"],"industry":["saas-landing","ecommerce","travel","agency"],"tone":["professional","premium"],"entry":"FeatureComparisonSticky.tsx","requires":[],"props":{"heading":{"type":"string"},"items":{"type":"array"}},"complexity":"section","previewDescription":"Sticky comparison rows that keep key benefits visible while users scan options."}