{"id":"sticky-cta.floating","sectionType":"sticky-cta","layout":"floating","style":["modern-minimal","corporate","dark-tech"],"industry":["*"],"tone":["professional","bold","luxury"],"entry":"StickyCtaFloating.tsx","requires":[],"dependsOnComponents":[],"complexity":"composite","props":{"label":{"type":"string"},"href":{"type":"string"},"price":{"type":"string"}},"previewDescription":"Persistent floating call-to-action that appears after the visitor scrolls into the page."}