{"id":"full-bleed-media.cinematic","sectionType":"full-bleed-media","layout":"cinematic","style":["editorial-serif","modern-minimal","dark-tech"],"industry":["*"],"tone":["luxury","editorial","bold"],"entry":"FullBleedMediaCinematic.tsx","requires":[],"props":{"heading":{"type":"string"},"subheading":{"type":"string"},"imageUrl":{"type":"string"},"imageAlt":{"type":"string"},"href":{"type":"string"}},"complexity":"section","previewDescription":"Full viewport-width visual statement with cinematic image, copy and optional CTA."}